smartctl 7.2 2020-12-30 r5155 [x86_64-linux-5.4.174-2-pve] (local build)
Copyright (C) 2002-20, Bruce Allen, Christian Franke, www.smartmontools.org

=== START OF INFORMATION SECTION ===
Model Family:     Western Digital Red
Device Model:     WDC WD40EFRX-68WT0N0
Serial Number:    WD-XXXXXXXX
LU WWN Device Id: 0 000000 000000000
Firmware Version: 00.02C.5
User Capacity:    4,000,787,030,016 bytes [4.00 TB]
Sector Size:      512 bytes logical/physical
Device is:        In smartctl database [for details use: -P show]
ATA Version is:   [No Information Found]
Local Time is:    Thu Mar 17 19:15:37 2022 CST
SMART support is: Available - device has SMART capability.
SMART support is: Enabled

=== START OF READ SMART DATA SECTION ===
SMART overall-health self-assessment test result: PASSED

General SMART Values:
Offline data collection status:  (0x80) Offline data collection activity
                                        was never started.
                                        Auto Offline Data Collection: Enabled.
Self-test execution status:      (   0) The previous self-test routine completed
                                        without error or no self-test has ever 
                                        been run.
Total time to complete Offline 
data collection:                (52860) seconds.
Offline data collection
capabilities:                    (0x7b) SMART execute Offline immediate.
                                        Auto Offline data collection on/off support.
                                        Suspend Offline collection upon new
                                        command.
                                        Offline surface scan supported.
                                        Self-test supported.
                                        Conveyance Self-test supported.
                                        Selective Self-test supported.
SMART capabilities:            (0x0003) Saves SMART data before entering
                                        power-saving mode.
                                        Supports SMART auto save timer.
Error logging capability:        (0x01) Error logging supported.
                                        General Purpose Logging supported.
Short self-test routine 
recommended polling time:        (   2) minutes.
Extended self-test routine
recommended polling time:        ( 529) minutes.
Conveyance self-test routine
recommended polling time:        (   5) minutes.

SMART Attributes Data Structure revision number: 16
Vendor Specific SMART Attributes with Thresholds:
ID# ATTRIBUTE_NAME          FLAG     VALUE WORST THRESH TYPE      UPDATED  WHEN_FAILED RAW_VALUE
  1 Raw_Read_Error_Rate     0x0000   200   200   000    Old_age   Offline      -       44
  3 Spin_Up_Time            0x0000   178   177   000    Old_age   Offline      -       8066
  4 Start_Stop_Count        0x0000   100   100   000    Old_age   Offline      -       188
  5 Reallocated_Sector_Ct   0x0000   198   198   000    Old_age   Offline      -       96
  7 Seek_Error_Rate         0x0000   200   200   000    Old_age   Offline      -       0
  9 Power_On_Hours          0x0000   081   081   000    Old_age   Offline      -       14207
 10 Spin_Retry_Count        0x0000   100   100   000    Old_age   Offline      -       0
 11 Calibration_Retry_Count 0x0000   100   253   000    Old_age   Offline      -       0
 12 Power_Cycle_Count       0x0000   100   100   000    Old_age   Offline      -       63
184 End-to-End_Error        0x0000   100   100   000    Old_age   Offline      -       0
187 Reported_Uncorrect      0x0000   100   100   000    Old_age   Offline      -       0
188 Command_Timeout         0x0000   100   066   000    Old_age   Offline      -       55
190 Airflow_Temperature_Cel 0x0000   059   047   000    Old_age   Offline      -       41
192 Power-Off_Retract_Count 0x0000   200   200   000    Old_age   Offline      -       44
193 Load_Cycle_Count        0x0000   187   187   000    Old_age   Offline      -       40170
194 Temperature_Celsius     0x4000   111   099   000    Old_age   Offline      -       41
195 Hardware_ECC_Recovered  0x0000   200   200   000    Old_age   Offline      -       0
196 Reallocated_Event_Count 0x7200   104   104   000    Old_age   Offline      -       96
197 Current_Pending_Sector  0x0000   200   200   000    Old_age   Offline      -       0
198 Offline_Uncorrectable   0x0000   100   253   000    Old_age   Offline      -       0
199 UDMA_CRC_Error_Count    0x0000   200   200   000    Old_age   Offline      -       19
200 Multi_Zone_Error_Rate   0x0000   100   253   000    Old_age   Offline      -       0
240 Head_Flying_Hours       0x0000   076   076   000    Old_age   Offline      -       17758
241 Total_LBAs_Written      0x0000   200   200   000    Old_age   Offline      -       24380737024
242 Total_LBAs_Read         0x0000   200   200   000    Old_age   Offline      -       58646873841

SMART Error Log Version: 1
No Errors Logged

SMART Self-test log structure revision number 1
Num  Test_Description    Status                  Remaining  LifeTime(hours)  LBA_of_first_error
# 1  Short offline       Completed without error       00%     14189         -
# 2  Short offline       Completed without error       00%     14165         -
# 3  Short offline       Completed without error       00%     14141         -
# 4  Short offline       Completed without error       00%     14117         -
# 5  Short offline       Completed without error       00%     14095         -
# 6  Short offline       Completed without error       00%     14070         -
# 7  Short offline       Completed without error       00%     14047         -
# 8  Short offline       Completed without error       00%     14021         -
# 9  Short offline       Completed without error       00%     13997         -
#10  Short offline       Completed without error       00%     13973         -
#11  Short offline       Completed without error       00%     13949         -
#12  Short offline       Completed without error       00%     13925         -
#13  Short offline       Completed without error       00%     13901         -
#14  Short offline       Completed without error       00%     13877         -
#15  Short offline       Completed without error       00%     13853         -
#16  Short offline       Completed without error       00%     13830         -
#17  Short offline       Completed without error       00%     13806         -
#18  Short offline       Completed without error       00%     13782         -
#19  Short offline       Completed without error       00%     13758         -
#20  Short offline       Completed without error       00%     13734         -
#21  Short offline       Completed without error       00%     13710         -

SMART Selective self-test log data structure revision number 1
 SPAN  MIN_LBA  MAX_LBA  CURRENT_TEST_STATUS
    1        0        0  Not_testing
    2        0        0  Not_testing
    3        0        0  Not_testing
    4        0        0  Not_testing
    5        0        0  Not_testing
Selective self-test flags (0x0):
  After scanning selected spans, do NOT read-scan remainder of disk.
If Selective self-test is pending on power-up, resume after 0 minute delay.
